url,title,text
https://www.bbc.com/news/articles/c4gz3r46e37o?at_medium=RSS&at_campaign=rss,Gaza doctors investigate 'signs of torture' on unnamed dead returned by Israel,"Gaza doctors struggle to investigate 'signs of torture' on unnamed dead returned by Israel

4 hours ago Share Save Lucy Williamson Middle East correspondent, in Jerusalem Share Save

AFP The bodies of the dead Palestinians were transferred by the Red Cross in refrigerated lorries

Out of a single room, with no DNA testing facilities or cold storage units of its own, the forensics team at Gaza's Nasser hospital face the challenges brought by peace. Over the past eleven days, 195 bodies have been returned to Gaza by Israeli authorities, in exchange for the bodies of 13 Israeli hostages, under the terms of Donald Trump's ceasefire deal. Photographs released by Gaza's medical authorities show some of the bodies badly decomposed, and arriving in civilian clothes or naked except for underwear, some with multiple signs of injury. Many have their wrists tied behind their backs, and doctors say some bodies arrived blindfolded or with cloth roped around their necks. The forensic team at Nasser hospital are working with almost no resources to answer vast questions about torture, mistreatment and identity. The head of the unit, Dr Ahmed Dheir, said one of their biggest limitations is a lack of cold storage space. The bodies arrive in Gaza thoroughly frozen and can take several days to thaw out, ruling out even basic identification methods like dental history, let alone any deeper investigation or post-mortem (autopsy). ""The situation is extremely challenging,"" he said. ""If we wait for the bodies to thaw, rapid decomposition begins almost immediately, putting us in an impossible position [because] we lose the ability to examine the remains properly. So the most viable method is to take samples and document the state of the bodies as they are.""

Dr Ahmed Dheir says the lack of cold storage space means he and his colleagues have little time to examine the remains properly

The BBC has viewed dozens of photographs of the bodies, many of them shared by Gaza's health authorities, others taken by colleagues on the ground. We spoke to several of those involved in examining the bodies in Gaza, as well as families of the missing, human rights groups, and Israeli military and prison authorities. We also spoke to three forensic experts outside the region, including one specialising in torture, to educate ourselves about the medical processes involved in this kind of investigation – all agreed that there were questions that were difficult to answer without post-mortems. Dr Alaa al-Astal, one of the forensic team at Nasser hospital, said some of the bodies arriving there showed ""signs of torture"", such as bruises and marks from binding on the wrists and ankles. ""There were extremely horrific cases, where the restraint was so tight that blood circulation to the hands was cut off, leading to tissue damage and clear signs of pressure around the wrists and ankles,"" he said. ""Even around the eyes, when the blindfolds were removed, you could see deep grooves - imagine how much force that took. The pressure left actual marks where the blindfold had been tied."" Dr Astal also mentioned the loose cloths tied around the necks of some bodies as needing further investigation. ""In one case, there was a groove around the neck,"" he said. ""To determine whether the death was due to hanging or strangulation, we needed to perform a post-mortem, but because the body was frozen, it was not dissected.""

The bodies are bring brought to a temporary facility at Nasser hospital in Khan Younis

Sameh Yassin Hamad, a member of the Hamas-run government committee responsible for receiving the bodies, said there were signs of bruising and blood infiltration indicating that the bodies had been severely beaten before death. He also said there were stab wounds on the chest or face of some of them. Some of the images we saw from the unit clearly show deep indentations or tightly-fastened cable-ties on the wrists and arms and ankles. One photograph appears to show the bruising and abrasion that would confirm that ties had been used while the person was still alive. Other bodies showed only deep indentation marks, meaning a post-mortem would be needed to determine whether the ties had been used before or after death. Cable-ties are sometimes used when transporting bodies in Israel. When we asked Israel's military about the evidence we gathered, it said it operates strictly in accordance with international law. We showed the photographs we were given to the outside forensic experts. The images represent a fraction of the bodies transferred to Gaza by the Red Cross. All three experts said that some of the markings raised questions about what had happened, but that it was difficult to reach concrete conclusions about abuse or torture without post-mortems. ""What is happening in Gaza is an international forensic emergency,"" said Michael Pollanen, a forensic pathologist and professor at the University of Toronto. ""Based upon images like this, there is an imperative for complete medical autopsies. We need to know the truth behind how deaths occurred, and the only way to know the truth is to do autopsies."" But even with limited forensic data, doctors at Nasser hospital say the routine cuffing of wrists behind the body rather than in front, along with the marks observed on the limbs, points to torture. ""When a person is naked, with their hands tied behind their back, and visible restraint marks on their wrists and ankles, it indicates that they died in that position,"" Dr Dheir told us. ""This is a violation of international law."" And there is strong evidence to suggest widespread abuse of detainees - including civilians - in Israeli custody in the months after the war began in October 2023, particularly in the military facility of Sde Teiman.

Unidentified bodies are being buried in a mass grave once forensic exams have been carried out

""At least in the first eight months of the war, the detainees from Gaza were cuffed behind their backs, and had their eyes covered, 24 hrs, 7 days a week, for months,"" said Naji Abbas, head of the Prisoners and Detainees Programme at the Israeli human rights organisation, Physicians for Human Rights (PHRI). ""We know that people developed serious infections on their skin, hands and legs because of the cuffs."" We have spoken to several people who worked at Sde Teiman over the past two years, who confirm that detainees were cuffed hand and foot – even while undergoing medical treatments, including surgery. One medic who worked there said he had campaigned to loosen the cuffs, and that the treatment of detainees there was ""dehumanisation"". But many of those detained during the Gaza war are held as unlawful combatants, without charge. One complication for doctors at Nasser Hospital now is determining which of the returned bodies are Hamas fighters killed in combat, which are civilians and which are detainees who died in Israeli custody. Some of the bodies returned by Israel are still wearing Hamas headbands or military boots, but doctors say most are either naked or in civilian clothing, making it difficult to distinguish their role, interpret their injuries, and assess human rights violations. Photographs seen by the BBC show mostly naked or decomposed bodies. One dressed in civilian clothing and trainers has what officials say are two small bullet wounds in his back.

AFP Officials at Nasser hospital have been showing pictures of the bodies and any personal items to relatives of missing people

Sameh Yassin Hamad, from Gaza's Forensics Committee, said that Israel had sent back identification with only six of the 195 bodies it had returned – and that five of those names turned out to be wrong. ""Since these bodies were held by the Israeli authorities, they will have full data about them,"" said Dr Dheir. ""But they haven't shared that information with us through the Red Cross. We were sent DNA profiles for around half the total number of dead, but have not received any details about the dates or circumstances of death, or the time or place of detention."" We asked Israel's army about the details in this report, including striking allegations by Gaza's forensic team that Israel had removed single fingers and toes from the bodies for DNA testing. Israel's military said ""all bodies returned so far are combatants within the Gaza Strip."" It denied tying any bodies prior to their release. A spokeswoman for the Israeli Prime Minister's Office, Shosh Bedrosian, on Wednesday described the reports from Gaza as ""just more efforts to demonise Israel"" and suggested the media focus instead on the experience of Israeli hostages.

Somaya Abdullah was at the hospital looking for her son"
https://www.bbc.com/news/articles/cwy7gn1979go?at_medium=RSS&at_campaign=rss,Bank of England chief Afua Kyei tops 2026 Powerlist as UK's most influential black person,"Bank of England chief tops 2026 Powerlist as UK's most influential black person

9 hours ago Share Save Adina Campbell, UK correspondent and Anthea Lee, Senior producer Share Save

BBC Mum-of-four Afua Kyei says the Bank of England supports parents in the workplace

Afua Kyei, the Bank of England's chief financial officer, has been named the UK's most influential black person. The 43-year-old is one of the UK's most senior finance leaders, in charge of the financial governance of the Bank's £1 trillion balance sheet and funding reforms. The BoE executive director topped the 2026 Powerlist, which recognises the most powerful people of African, African Caribbean, and African American heritage in the UK. Other influential names include former footballer Ian Wright, who's new to the list, make-up artist Dame Pat McGrath and actor Idris Elba.

Kyei, who was recruited by the Canadian Prime Minister Mark Carney in his former role as the governor of the Bank of England, said topping the list was ""incredibly humbling"". The mum-of-four said growing up she saw obvious differences in the workplace. She said: ""I didn't see so many women in big leadership roles who had families and I know that there are lots of women who think that they need to choose between work and having a family. ""What I love about the Bank of England is that we really support working families and working parents."" Kyei studied chemistry at Oxford University and was also awarded a junior research fellowship by Princeton University in organic chemistry.

'You don't need to be a mathematician'

During the global financial crisis, she was an investment banker before joining Barclays Bank where she was the Chief Financial Officer for Mortgages. She joined the Bank of England in 2019 and is at the core of the Bank's leadership and decision making. She said her parents, who moved to the UK from Ghana to go to university at 18, have been her biggest role models. ""My mother came to Liverpool, trained to become a midwife and enjoyed a 40-year plus career working for the NHS. ""My father has enjoyed a long career in the oil industry. I saw them juggling work and home. They instilled really strong values in us,"" she added. Kyei hopes to inspire more young people to consider banking as a career. ""You don't need to be a mathematician, you don't need to be an accountant and you don't need to be an economist. What we're looking for is fresh perspectives and we want the best people"". Kyei takes the place of tech CEO Dean Forbes at the head of the list.

The rest of the 2026 Powerlist

Getty Images Getty Images for W Magazine 2. Ian Wright - Football Legend, Broadcaster & Advocate for Equity in Sport (New) 3. Dame Pat McGrath - Make-up artist/Founder, Pat McGrath Labs"
https://www.theverge.com/tech/805652/intel-q3-2025-earnings-18a-panther-lake-ai-gpus-annual,"Intel’s tick-tock isn’t coming back, and everything else I just learned","Today on the company’s Q3 2025 earnings call, where Intel saw its first profit in nearly two years due primarily to those lifelines, CEO Lip-Bu Tan and CFO David Zinsner explained how the company doesn’t yet have enough chips. It’s currently seeing shortages that it expects to peak in the first quarter of next year — in the meantime, leaders say they’re going to prioritize AI server chips over some consumer processors as it deals with supply and demand.

“We expect CCG [Intel’s consumer chips] to be down modestly and DCAI [Intel’s server chips] to be up strongly as we prioritize capacity for server shipments over entry level client parts,” Intel says. Tan revealed today that Intel will also release new AI GPUs each and every year, following Nvidia and AMD in shaking up their traditional cadence to address the huge demand for AI servers. It’s not clear what that might mean for those hoping for more Intel gaming GPUs.

While all eyes are on Intel’s hot new Panther Lake and its 18A process to show the world it can still make the most potent consumer PC chips and make them in-house, the company reiterated it’s only launching one SKU of Panther Lake this year and slowly rolling out others in 2026. Here’s another possible reason why: Zinsner hinted today that Panther Lake will be a “pretty expensive” product to start with, and Intel’s going to have to push its existing Lunar Lake chips instead “in at least the first half of the year.”

While Intel has repeatedly pushed back against the idea that its 18A process had poor yields, the company admitted to investors and analysts today that it’s not ready to be a huge financial success either: yields are “adequate to address the supply but not where we need them to be to drive the appropriate level of margins,” says Zinsner, suggesting that it might be 2026, or even 2027 for an “acceptable level of yields” in that regard.

For now, Intel will be “working closely with customers to maximize our available output, including adjusting pricing and mix, to shift demand towards products where we have supply and they have demand” — which sounds like playing with the prices it charges PC makers to stick Intel inside their computers and pointing them at Lunar Lake parts instead of hot new ones. Tan reiterated today that he’s not going to invest in more capacity unless there’s “committed external demand,” and Zinsner says investments in capacity next year won’t “significantly change expectations”.

Intel says that 18A will be a “long-lived node” that will power “at least the next three generations of client and server products.” If you were hoping for a return to the “tick-tock” days where Intel would alternate between shrinking its chips and releasing new architectures every generation, that’s not happening here.

But that doesn’t mean Intel will cancel its next node, Intel 14A, as it warned it might. Tan suggested today that customers have stepped in to save 14A, and Intel, that the company is “delighted and more confident” in it, and Zinsner says it’s not only “off to a good start,” but better than 18A was at this point “in terms of performance and yields.”"
